{
  "version": 1,
  "source": "opennow-stable/src/shared/gfn/api.ts:OpenNowApi",
  "columns": ["legacy", "kind", "requestSchema", "resultSchema", "owner", "replacement", "status", "requestFixture", "resultFixture"],
  "operations": [
    ["getAuthSession","request","AuthSessionRequest | undefined","AuthSessionResult","core","auth.session.get","ported",{}, {"session":null}],
    ["getLoginProviders","request","void","LoginProvider[]","core","auth.providers.list","ported",{}, []],
    ["getRegions","request","RegionsFetchRequest | undefined","StreamRegion[]","core","network.regions.list","ported",{}, []],
    ["login","request","AuthLoginRequest","AuthSession","core","auth.device.start + auth.device.poll + auth.device.complete","superseded",{"provider":"nvidia"},{"session":null}],
    ["startDeviceLogin","request","AuthDeviceLoginStartRequest","AuthDeviceLoginChallenge","core","auth.device.start","ported",{"provider":"nvidia"},{"attemptId":"fixture","userCode":"ABCD-EFGH"}],
    ["pollDeviceLogin","request","AuthDeviceLoginPollRequest","AuthDeviceLoginPollResult","core","auth.device.poll","ported",{"attemptId":"fixture","deviceCode":"redacted-fixture"},{"status":"pending"}],
    ["completeDeviceLogin","request","AuthDeviceLoginAttemptRequest","AuthSession","core","auth.device.complete","ported",{"attemptId":"fixture"},{"session":null}],
    ["cancelDeviceLogin","request","AuthDeviceLoginAttemptRequest","void","core","auth.device.cancel","ported",{"attemptId":"fixture"},null],
    ["logout","request","void","void","core","auth.logout","ported",{},null],
    ["logoutAll","request","void","void","core","auth.accounts.logoutAll","ported",{},null],
    ["getSavedAccounts","request","void","SavedAccount[]","core","auth.accounts.list","ported",{},[]],
    ["switchAccount","request","{userId:string,pin?:string}","AuthSession","core","auth.accounts.switch","ported",{"userId":"fixture-user"},{"session":null}],
    ["removeAccount","request","{userId:string}","void","core","auth.accounts.remove","ported",{"userId":"fixture-user"},null],
    ["getConsolePinStatus","request","{userId:string}","ConsolePinStatus","core","auth.pin.status","ported",{"userId":"fixture-user"},{"configured":false}],
    ["setConsolePin","request","ConsolePinSetRequest","ConsolePinMutationResult","core","auth.pin.set","ported",{"userId":"fixture-user","pin":"0000"},{"ok":true}],
    ["clearConsolePin","request","ConsolePinClearRequest","ConsolePinMutationResult","core","auth.pin.clear","ported",{"userId":"fixture-user","pin":"0000"},{"ok":true}],
    ["verifyConsolePin","request","ConsolePinVerifyRequest","ConsolePinVerifyResult","core","auth.pin.verify","ported",{"userId":"fixture-user","pin":"0000"},{"verified":true}],
    ["fetchSubscription","request","SubscriptionFetchRequest","SubscriptionInfo","core","account.subscription.get","ported",{},{}],
    ["fetchPersistentStorageLocations","request","PersistentStorageLocationsFetchRequest | undefined","PersistentStorageLocationsResult","core","account.storage.locations","ported",{}, {"locations":[]}],
    ["resetPersistentStorage","request","PersistentStorageResetRequest & {scope:AccountScope}","PersistentStorageResetResult","core","account.storage.reset","ported",{"confirmed":true,"scope":{"generation":1,"userId":"fixture-user","providerIdpId":"fixture-provider"}}, {"ok":true}],
    ["fetchGameAccountConnections","request","void","GameAccountConnectionsResult","core","account.connections.list","ported",{}, {"connections":[]}],
    ["linkGameAccount","request","GameAccountOperationRequest & {scope:AccountScope}","GameAccountOperationResult","core","account.connections.link.start + account.connections.link.poll","superseded",{"provider":"steam","scope":{"generation":1,"userId":"fixture-user","providerIdpId":"fixture-provider"}},{"status":"pending"}],
    ["unlinkGameAccount","request","GameAccountOperationRequest & {scope:AccountScope}","GameAccountOperationResult","core","account.connections.unlink","ported",{"provider":"steam","scope":{"generation":1,"userId":"fixture-user","providerIdpId":"fixture-provider"}},{"ok":true}],
    ["resyncGameAccount","request","GameAccountOperationRequest & {scope:AccountScope}","GameAccountOperationResult","core","account.connections.sync","ported",{"provider":"steam","scope":{"generation":1,"userId":"fixture-user","providerIdpId":"fixture-provider"}},{"ok":true}],
    ["fetchMainGames","request","GamesFetchRequest","GameInfo[]","core","catalog.public.list","superseded",{},[]],
    ["fetchStorePanels","request","GamesFetchRequest","GamePanelResult[]","core","catalog.public.list + Qt catalog projection","superseded",{},[]],
    ["fetchFeaturedGames","request","GamesFetchRequest","GameInfo[]","core","catalog.public.list + Qt featured projection","superseded",{},[]],
    ["fetchLibraryGames","request","GamesFetchRequest","GameInfo[]","core","catalog.library.list","ported",{},[]],
    ["browseCatalog","request","CatalogBrowseRequest","CatalogBrowseResult","core","catalog.public.list + Qt filters","superseded",{}, {"games":[]}],
    ["fetchPublicGames","request","void","GameInfo[]","core","catalog.public.list","ported",{},[]],
    ["resolveLaunchAppId","request","ResolveLaunchIdRequest","string | null","core","catalog public/library normalized launchAppId","superseded",{"appId":"123"},"123"],
    ["resolveStoreUrl","request","ResolveStoreUrlRequest","string | null","core","catalog normalized storeUrl","superseded",{"appId":"123"},null],
    ["markGameOwned","request","MarkGameOwnedRequest","MarkGameOwnedResult","core","account.connections.sync + catalog.library.list","superseded",{"appId":"123"},{"ok":true}],
    ["getPendingDirectLaunchRequest","request","void","DirectLaunchRequest | null","qt","AppController.handleArguments","superseded",{},null],
    ["onDirectLaunchRequest","event","void","DirectLaunchRequest","qt","AppController.directLaunchRequested","ported",{}, {"appId":"123","title":"Fixture Game"}],
    ["createSession","request","SessionCreateRequest","SessionInfo","core","session.create","ported",{"appId":"123"},{"status":1}],
    ["pollSession","request","SessionPollRequest","SessionInfo","core","session.poll","ported",{"sessionId":"fixture-session"},{"status":1}],
    ["reportSessionAd","request","SessionAdReportRequest","SessionInfo","core","session.ad.report","ported",{"sessionId":"fixture-session"},{"status":1}],
    ["stopSession","request","SessionStopRequest","void","core","session.stop","ported",{"sessionId":"fixture-session"},null],
    ["getActiveSessions","request","{token?:string,streamingBaseUrl?:string}","ActiveSessionInfo[]","core","session.remote.list","ported",{},[]],
    ["claimSession","request","SessionClaimRequest","SessionInfo","core","session.claim","ported",{"sessionId":"fixture-session"},{"status":2}],
    ["getNativeStreamerStatus","request","void","NativeStreamerStatus","core","streamer.status.get","ported",{}, {"state":"idle"}],
    ["getNativeCloudGsyncCapabilities","request","void","NativeCloudGsyncCapabilities","streamer","capabilities event surfaced by streamer.status.get","superseded",{}, {"supported":false}],
    ["showSessionConflictDialog","request","void","SessionConflictChoice","qt","SessionConflictScreen","ported",{},"cancel"],
    ["connectSignaling","request","SignalingConnectRequest","void","core","streamer.start owns signaling lifecycle","superseded",{},null],
    ["disconnectSignaling","request","void","void","core","streamer.stop owns signaling lifecycle","superseded",{},null],
    ["sendAnswer","request","SendAnswerRequest","void","core","streamer.start child protocol relay","superseded",{},null],
    ["sendIceCandidate","request","IceCandidatePayload","void","core","streamer.start child protocol relay","superseded",{},null],
    ["sendNativeInput","send","NativeInputPacket","void","streamer","native input transport","superseded",{"kind":"keyboard"},null],
    ["setNativeInputPaused","send","boolean","void","core","streamer.input.pause","ported",{"paused":true},null],
    ["updateNativeRenderSurface","send","NativeRenderSurfaceUpdate","void","core","streamer.surface.update","ported",{"visible":true},null],
    ["updateNativeShortcuts","send","NativeStreamerShortcutBindings","void","streamer","streamer.start shortcut bindings","superseded",{},null],
    ["requestKeyframe","request","KeyframeRequest","void","core","streamer.control request-keyframe","superseded",{},null],
    ["onSignalingEvent","event","void","MainToRendererSignalingEvent","core","streamer.changed event","superseded",{}, {"type":"status"}],
    ["onToggleFullscreen","event","void","void","qt","streamer shortcut routed through ShellStore","superseded",{},null],
    ["onExitFullscreen","event","void","void","qt","deterministic overlay/back handling","superseded",{},null],
    ["quitApp","request","void","void","qt","QCoreApplication.quit","ported",{},null],
    ["getUpdaterState","request","void","AppUpdaterState","core","updater.state.get","ported",{}, {"status":"idle"}],
    ["checkForUpdates","request","void","AppUpdaterState","core","updater.check","ported",{}, {"status":"not-available"}],
    ["downloadUpdate","request","void","AppUpdaterState","core","updater.download","ported",{}, {"status":"downloaded"}],
    ["installUpdateAndRestart","request","void","AppUpdaterState","core","updater.install","ported",{}, {"status":"installing"}],
    ["onUpdaterStateChanged","event","void","AppUpdaterState","core","updater.changed event","ported",{}, {"status":"idle"}],
    ["setFullscreen","request","boolean","void","qt","Window visibility/fullscreen state","ported",{"value":true},null],
    ["toggleFullscreen","request","void","void","qt","Window visibility/fullscreen state","ported",{},null],
    ["togglePointerLock","request","void","void","streamer","native input ownership contract","superseded",{},null],